{
  "schema_version": "1.0.0",
  "requestId": "req-3f21aa",
  "records": {
    "totalRecords": 1,
    "currentPageSize": 1,
    "currentPageNumber": 0,
    "cursor": null
  },
  "callTranscripts": [
    {
      "callId": "7782934451002",
      "transcript": [
        {
          "speakerId": "4521",
          "topic": "Renewals",
          "sentences": [
            {
              "start": 418000,
              "end": 430500,
              "text": "Our renewal invoice came through with the full annual amount and there is no line anywhere showing the dues we already paid in March."
            },
            {
              "start": 430500,
              "end": 437000,
              "text": "We raised it in March and it has happened on every renewal since."
            }
          ]
        }
      ]
    }
  ],
  "meta": {
    "window": {
      "from": "2026-09-08T00:00:00Z",
      "to": "2026-09-08T23:59:59Z"
    },
    "rows_returned": 1,
    "row_cap": 200,
    "withheld_comment_count": null,
    "fields_allowlisted": [
      "callId",
      "transcript"
    ]
  }
}
